{"analysis":{"quality":{"chapter_boundary_confidence":0.9,"ocr_used":false},"unsupported_elements":[],"warnings":[{"code":"OCR_QUALITY_ISSUES","count":31,"severity":"medium"}]},"artifact_type":"manuscript","artifact_version":"1","content":{"blocks":[{"id":"b_000001","source_loc":{"doc_paragraph_index":1},"spans":[{"marks":["bold"],"text":"The Long Quiet"}],"type":"paragraph"},{"id":"b_000002","source_loc":{"doc_paragraph_index":2},"spans":[{"marks":["italic"],"text":"A Gentle Guide to Moving Through"}],"type":"paragraph"},{"id":"b_000003","source_loc":{"doc_paragraph_index":3},"spans":[{"marks":["italic"],"text":"Depression and Seclusion"}],"type":"paragraph"},{"id":"b_000004","source_loc":{"doc_paragraph_index":4},"spans":[{"marks":[],"text":"For anyone who has been walking through the fog"}],"type":"paragraph"},{"id":"b_000005","source_loc":{"doc_paragraph_index":5},"spans":[{"marks":[],"text":"longer than they thought they would."}],"type":"paragraph"},{"id":"b_000006","source_loc":{"doc_paragraph_index":6},"spans":[{"marks":["bold"],"text":"A Note Before You Begin"}],"type":"paragraph"},{"id":"b_000007","source_loc":{"doc_paragraph_index":7},"spans":[{"marks":[],"text":"If you are reading this, something brought you here. Maybe it is a slow, heavy season that has gone on longer than any of the seasons before it. Maybe a friend pressed this into your hands. Maybe you cannot remember the last time you looked forward to a day. Whatever has brought you to this page, I want to start by saying something simple: you are not broken, and you are not alone."}],"type":"paragraph"},{"id":"b_000008","source_loc":{"doc_paragraph_index":8},"spans":[{"marks":[],"text":"This book is not a cure. Nothing written in a book can be. What you will find here are ideas, small tools, and the kind of quiet company that a page can sometimes offer. It is meant to sit beside you, not to fix you. If you read only a paragraph a day, that is enough. If you put it down for weeks and return, that is enough. If you read only the parts that call to you and skip the rest, that is enough, too."}],"type":"paragraph"},{"id":"b_000009","source_loc":{"doc_paragraph_index":9},"spans":[{"marks":[],"text":"A word about what this book is not. It is not a replacement for the care of a trained therapist, counselor, doctor, or psychiatrist. Depression is a real and serious condition, and many people benefit enormously from professional support, including talk therapy and medication. If you are in crisis, or if you find yourself having thoughts of ending your life or hurting yourself, please reach out to someone now. In the United States, you can call or text 988, the Suicide and Crisis Lifeline, at any hour. In other countries, a quick search for \"crisis line\" and your country will bring up a number. You deserve to talk to someone who can help, and that help is closer than it may feel."}],"type":"paragraph"},{"id":"b_000010","source_loc":{"doc_paragraph_index":10},"spans":[{"marks":[],"text":"The pages that follow are gentle. They move slowly. They ask very little of you. They assume that getting out of bed today might have taken effort that no one else could see. They assume that your life, even at its quietest, is worth the care you are trying to give it by being here at all."}],"type":"paragraph"},{"id":"b_000011","source_loc":{"doc_paragraph_index":11},"spans":[{"marks":[],"text":"Take your time. There is no test at the end."}],"type":"paragraph"},{"id":"b_000012","source_loc":{"doc_paragraph_index":12},"spans":[{"marks":["bold"],"text":"Part One\nUnderstanding"}],"type":"paragraph"},{"id":"b_000013","meta":{"chapter_number":1},"source_loc":{"doc_paragraph_index":13},"spans":[{"marks":["bold"],"text":"Chapter 1\nWhat Depression Actually Is"}],"type":"chapter_heading"},{"id":"b_000014","source_loc":{"doc_paragraph_index":14},"spans":[{"marks":[],"text":"Before anything else, it helps to be clear about what we are talking about. The word depression gets used so loosely in everyday speech that the thing itself can start to feel small. Someone says they are depressed because their team lost a game. Someone else says it because the weather has been gray. These uses are fine in casual conversation, but they can quietly make it harder for someone in a real depressive episode to recognize what they are going through, because what they are going through does not feel like those things at all."}],"type":"paragraph"},{"id":"b_000015","source_loc":{"doc_paragraph_index":15},"spans":[{"marks":[],"text":"Clinical depression, which is what this book is mostly about, is not the same as ordinary sadness. Ordinary sadness has a shape. Something happens, or something changes, and you feel down. You cry, or you do not. A day passes, or a few days. The feeling lifts, comes back, lifts again. Sadness is a visitor, even when it stays for a while."}],"type":"paragraph"},{"id":"b_000016","source_loc":{"doc_paragraph_index":16},"spans":[{"marks":[],"text":"Depression is different. It is less like a visitor and more like weather that settles in and does not move. It affects not just mood but energy, appetite, sleep, concentration, and the ability to feel pleasure or interest in things that used to matter. It changes how you think about yourself and your life. It can make small tasks feel enormous and enormous tasks feel impossible. It can make the future disappear, or it can shrink the future into a flat gray line."}],"type":"paragraph"},{"id":"b_000017","source_loc":{"doc_paragraph_index":17},"spans":[{"marks":[],"text":"One of the hardest parts of depression is that it lies about itself. It tells you that you are lazy, that you are weak, that you have always been like this, that everyone else can manage their lives and you simply cannot. It tells you that the way you feel right now is the truth of who you are, and that the other, lighter version of yourself you can sometimes dimly remember was an act, or a fluke, or somebody else entirely. None of that is accurate. But depression is very convincing. It uses your own voice."}],"type":"paragraph"},{"id":"b_000018","source_loc":{"doc_paragraph_index":18},"spans":[{"marks":[],"text":"Researchers and clinicians understand depression as a condition with many contributing causes. Genetics play a role, which is why it often runs in families. Brain chemistry plays a role. So do life events, long-term stress, grief, trauma, illness, hormones, medications, seasons, diet, sleep, loneliness, and the particular story your mind has been telling about your life. Depression is not a single thing with a single switch. It is more like the end result of many smaller currents that, together, pull a person under."}],"type":"paragraph"},{"id":"b_000019","source_loc":{"doc_paragraph_index":19},"spans":[{"marks":[],"text":"This is important to know because it changes what recovery looks like. If depression were caused by one thing, there would be one fix. But because it rises out of many sources, moving through it usually involves many small changes rather than one dramatic intervention. Therapy might help. Medication might help. Sleep might help. Sunlight might help. A friend might help. Movement might help. None of these alone is a cure, and none of them alone is the whole picture. Together, over time, they can gradually change the ground beneath your feet."}],"type":"paragraph"},{"id":"b_000020","source_loc":{"doc_paragraph_index":20},"spans":[{"marks":[],"text":"One more thing worth saying in this first chapter. Depression is common. It is one of the most common conditions in the world, affecting hundreds of millions of people across every culture and age. If you have it, you are part of a very large and mostly invisible company of people, including people you know, including people you admire, including people who have done extraordinary things with their lives. Having depression does not set you apart from humanity. It binds you to it."}],"type":"paragraph"},{"id":"b_000021","meta":{"chapter_number":2},"source_loc":{"doc_paragraph_index":21},"spans":[{"marks":["bold"],"text":"Chapter 2\nThe Shape of Seclusion"}],"type":"chapter_heading"},{"id":"b_000022","source_loc":{"doc_paragraph_index":22},"spans":[{"marks":[],"text":"Alongside depression, many people experience a retreat from the world. We will call this seclusion, though it goes by many names: withdrawal, isolation, hibernation, hiding. Sometimes seclusion is a direct symptom of depression. Sometimes it is a response to something else entirely, like social anxiety, burnout, grief, illness, or a long season of hurt. Sometimes it starts for one reason and keeps going for another."}],"type":"paragraph"},{"id":"b_000023","source_loc":{"doc_paragraph_index":23},"spans":[{"marks":[],"text":"Seclusion is not always bad. Human beings need time alone. Solitude, chosen freely and balanced with connection, is healthy and even necessary. Quiet is how many of us think, rest, create, and restore ourselves. The kind of seclusion this book is concerned with is different. It is the kind that creeps up on you, that starts with canceling one plan and ends with realizing you have not left the house in weeks. It is the kind that is not quite chosen, even though you are the one doing the choosing. It has a pulled-down, locked-in quality. It is not rest. It is something more like holding your breath."}],"type":"paragraph"},{"id":"b_000024","source_loc":{"doc_paragraph_index":24},"spans":[{"marks":[],"text":"If you are in that kind of seclusion, you probably know the shape of it very well. The phone buzzes and you watch it as if it belongs to someone else. You see a friend's message and you mean to reply; you really mean to, and then three days pass. A week. A month. Each day that you do not answer, it gets a little harder to imagine answering. The silence grows, and the longer it grows, the more it starts to feel like proof of something you secretly believed about yourself all along."}],"type":"paragraph"},{